{
  "protocol": 2,
  "package": "folder",
  "version": "0.1.0",
  "environment": { "kind": "node", "node": ">=22" },
  "types": [
    {
      "id": "watch",
      "kind": "source",
      "label": "Watch a folder",
      "description": "Starts a run for each new file that appears in one folder, once its size and time have not changed for 2 seconds; a write that pauses for longer than that is passed on twice, at the pause and again once whole. The files already there the first time it starts are left alone. A file that changes after it was passed on, or is renamed, is passed on again as a new file.",
      "icon": "font-awesome/fa-folder-open-o",
      "command": ["{node}", "{package}/dist/folder.cjs"],
      "config": {
        "type": "object",
        "required": ["folder"],
        "properties": {
          "folder": {
            "type": "string",
            "title": "Folder",
            "description": "The folder to watch. Folders inside it are not watched.",
            "minLength": 1
          }
        }
      },
      "outputs": [{ "port": "created", "event": "folder.file.created.v1" }]
    }
  ]
}
